{
  "schema_version": 1,
  "audit_id": "demo-aesthetics-clinic-reputation-gap",
  "product": "growth_score",
  "title": "Synthetic Reputation Practice",
  "subject_type": "public_business",
  "audit_format": "single_location",
  "status": "approved_report",
  "evidence_policy": "public_sources_only",
  "repository_access": ["zaomir/grainee-v2", "zaomir/caesthetic"],
  "authoring_source_paths": ["docs/audits/caesthetic/growth-score/cases/demo-aesthetics-clinic-reputation-gap/reports/standalone.json"],
  "report_paths": ["docs/audits/caesthetic/growth-score/cases/demo-aesthetics-clinic-reputation-gap/reports/standalone.json"],
  "production_report_paths": ["site-caesthetic/score/demo-aesthetics-clinic-reputation-gap/report.json"]
}
