{
  "schema_version": 1,
  "audit_id": "spoken-medspa-snellville-2026",
  "product": "growth_score",
  "title": "Spoken Med Spa",
  "subject_type": "aesthetic_practice",
  "audit_format": "single_location",
  "status": "approved_report",
  "evidence_policy": "public_sources_only",
  "repository_access": ["zaomir/grainee-v2", "zaomir/caesthetic"],
  "authoring_source_paths": ["docs/audits/caesthetic/growth-score/cases/spoken-medspa-snellville-2026/reports/standalone.json"],
  "report_paths": ["docs/audits/caesthetic/growth-score/cases/spoken-medspa-snellville-2026/reports/standalone.json"],
  "production_report_paths": ["site-caesthetic/score/spoken-medspa-snellville-9d7f3a5c2e184b61/report.json"]
}
