{
  "schema_version": 1,
  "audit_id": "demo-multi-location-growth-score",
  "product": "growth_score",
  "title": "Fictional Meridian Aesthetic Network",
  "subject_type": "public_business",
  "audit_format": "multi_location",
  "status": "approved_report",
  "evidence_policy": "public_sources_only",
  "repository_access": ["zaomir/grainee-v2", "zaomir/caesthetic"],
  "authoring_source_paths": ["docs/audits/caesthetic/growth-score/cases/demo-multi-location-growth-score/reports/network-parent.json", "docs/audits/caesthetic/growth-score/cases/demo-multi-location-growth-score/reports/focus-location.json"],
  "report_paths": [
    "docs/audits/caesthetic/growth-score/cases/demo-multi-location-growth-score/reports/network-parent.json",
    "docs/audits/caesthetic/growth-score/cases/demo-multi-location-growth-score/reports/focus-location.json"
  ],
  "production_report_paths": [
    "site-caesthetic/score/demo-multi-location-growth-score/report.json",
    "site-caesthetic/score/demo-multi-location-growth-score/focus-location/report.json"
  ]
}
